dataset,item_id,user_id,category_raw,category_group,fit,is_fit,is_small,is_large,is_nonfit,rating,quality,low_signal,size,height_inches,height_bucket,weight_lbs,weight_bucket,body_type,occasion,length,review_summary,review_text,pain_points,has_pain_point
renttherunway,537285,633585,dress,dress,fit,1,0,0,0,8.0,,0,8,67,5_7_to_5_9,130.0,120_to_150,athletic,wedding,unknown,"A comfortable, classy dress for when you want to stay low-key and no-fuss.","I wore this for a black tie wedding in December. I wanted a dress that was conservative and elegant. This was a great choice because while it was modest and classy, there were a few details that made this a little playful and sassy: the sequins up top, the silky pleated skirt, and the crop look with illusion mesh. Some dresses make you work to wear them, but this dress isn't! It's like wearing that comfy sweater - where you don't have to worry about bra straps sticking out, sheer material for an oops moment, too long trails, etc - but you still get to look fabulous.   For sizing, I think I could have even gone down one size as my waist is more petite, and that area is the most fitted area of the dress. However, I was happy with the size I got.  For dress length - I am 5'7"", wore 3"" heels with no platform height in the front. The SR dress fell about 2 inches from the ground.",length_issue;fabric_or_quality;chest_or_bust;waist_or_hip,1
renttherunway,1413486,52469,dress,dress,large,0,0,1,1,10.0,,0,12,64,5_3_to_5_6,120.0,120_to_150,hourglass,work,unknown,Great Dress!,"I loved the cut, the fabric and color scheme of this dress. It was very comfortable and professional for a work environment. I received compliments and felt great while wearing it. I would rent it again!   Measurements laying flat: Bust: 18"" Waist: 19"" Length (not including long pointy panel): 32.5""",length_issue;fabric_or_quality;chest_or_bust;waist_or_hip;color_expectation,1
renttherunway,2743152,759265,jumpsuit,jumpsuit,fit,1,0,0,0,10.0,,0,8,67,5_7_to_5_9,135.0,120_to_150,straight & narrow,party,unknown,"At my NYE event, I definitely stood out from the sea of short black sequined dresses!","This jumpsuit is so comfortable. My best friend was sad I rented it because she wanted to borrow it later! True to size, no issues with fit; made me look really lean even though I have a small tummy pooch (you can't tell!). I received compliments all night.",waist_or_hip,1
renttherunway,1547051,349844,gown,dress,fit,1,0,0,0,10.0,,0,13,69,5_7_to_5_9,135.0,120_to_150,hourglass,wedding,unknown,Elegant and Exquisite!,"I rented this dress for our Sedona, AZ elopement.  Beautiful gold and white to accent the exquisite red rock back drop.  I have received so many compliments on this dress and I felt elegant, sophisticated and feminine.  Very, comfortable dress - trudged up and down a mountain to get these shots with no issues!   This was very true to size - i am 5'9"" and wore the 6L.  I also wore 3"" heels in these photographs so the dress was the idea length.",length_issue;color_expectation,1
renttherunway,1449570,631817,dress,dress,small,0,1,0,1,10.0,,0,12,66,5_3_to_5_6,145.0,120_to_150,pear,wedding,unknown,Beautiful dress! Wore it as a bridesmaid dress.,"Definitely fitted. Luckily, I'm pretty flat chested so it wasn't a huge deal, but I do have a big rib cage so the dress was tight. Received many compliments on the dress! Pro- you don't have to worry about eating/drinking too much as it's forgiving. I was only sent one size, so I didn't have an option, but I would order a size up just in case!",too_small_or_tight;chest_or_bust,1
renttherunway,331636,669923,dress,dress,small,0,1,0,1,10.0,,0,24,62,under_5_3,150.0,120_to_150,apple,party,unknown,fun and sexy,"Pro: perfect length! Few accessories needed, great in photos, many compliments and very flattering! Cons: After a few hours of wearing it, got a bit itchy, don't plan on wearing a bra, definitely get tape and rides up  just a  bit",length_issue;fabric_or_quality;chest_or_bust;color_expectation,1
renttherunway,2090997,557458,jumpsuit,jumpsuit,fit,1,0,0,0,8.0,,0,20,66,5_3_to_5_6,,unknown,hourglass,date,unknown,Sexy for date night!,"I'm very curvy and this fit everything well. I didn't have much extra room in the torso, so while it was comfortable to wear to a theater show, I'm not sure how comfortable I would have been dancing or doing something requiring bending over, reaching, etc. without giving myself a wedgie! I needed help zipping and unzipping this, but there was a really nice lady in the bathroom who unzipped me then waited for me so she could zip me back up! The sleeves are very long and bunched up at the wrists a bit. There are no button holes, so I used the holes in the lace to push the buttons through. I played with turning the sleeves under for a hidden cuff, and that worked too. It is also very low cut and so I ultimately wore it with cami underneath (one pic has cami, the other one doesn't). I would wear it again.",fabric_or_quality,1
renttherunway,1295893,137309,gown,dress,fit,1,0,0,0,10.0,,0,3,64,5_3_to_5_6,115.0,under_120,petite,formal affair,unknown,"Simple, elegant, comfortable","The original dress I ordered wasn't available, so I had to pick this replacement quickly.  I was very happy with it.  I ordered the 2P because the last time I ordered a gown I ordered the Regular and I was stepping on it during the whole party.  This was the perfect length, and I wore two inch heels.  It was a bit snug in places, but that is they way it is supposed to fit, because it looked right and wasn't uncomfortable.  The material is heavy and stretchy so very comfortable and gives warmth at a winter party.  The slit lets you show some leg, which gave this simple dress a little splash of sexy!",too_small_or_tight;length_issue;fabric_or_quality,1
renttherunway,1226293,471590,shift,dress,fit,1,0,0,0,8.0,,0,8,65,5_3_to_5_6,130.0,120_to_150,pear,wedding,unknown,I wore this dress to a wedding and received compliments all night.,"The dress fit true to size. The sequins on the sleeves bothered me a little but nothing that was unbearable. I ordered the size 4 and 6 and ended up wearing the 4 since it was a tighter fit.  If you want the dress to fit like the model I would recommend ordering up a size or two.  Although I received a lot of compliments on the dress, the only downside for me was that people also recognized it as a RTR favorite.",too_small_or_tight;fabric_or_quality,1
renttherunway,2321929,139262,top,top,fit,1,0,0,0,10.0,,0,20,69,5_7_to_5_9,165.0,151_to_180,hourglass,everyday,unknown,Lovely!,"Beautiful top. I had to steam it, but it wasn't a big deal. The flow is just so pretty...and a pop of shoulder is a lot of fun. I wore to an evening affair, but if I owned this it would be my favorite work-to-night-out top because with a suit jacket, it's completely polished/professional and with the bare shoulders, it's flirty and feminine. Also, I have a long torso and the length was still good.",length_issue,1
renttherunway,301873,118182,sheath,dress,fit,1,0,0,0,10.0,,0,12,64,5_3_to_5_6,140.0,120_to_150,hourglass,party,unknown,I received so many compliments.  It fit like a glove tastefully.  I have rented this twice.,I wore a low back strapless bustier under the dress.  I kept the jewelry simple wearing only earrings.  You  have to take short steps as the dress is narrow and comes down below the knee.,chest_or_bust,1
renttherunway,2531493,494455,jumpsuit,jumpsuit,fit,1,0,0,0,6.0,,1,16,65,5_3_to_5_6,140.0,120_to_150,athletic,wedding,unknown,"Great, bold color","The top strap's clamps were both broken, and it arrived a day late (after I had already left for the wedding). Very disappointing because I've been wanting to wear this ever since I signed up for unlimited!",color_expectation,1
renttherunway,124553,675149,dress,dress,large,0,0,1,1,8.0,,0,4,62,under_5_3,115.0,under_120,petite,work,unknown,Added a belt & it worked great!,"This dress was beautiful, but I may order a size down next time. It was very spacious around the waist- so much so that I needed to wear a belt. Loved the slight high-low.",waist_or_hip,1
renttherunway,1698166,492384,dress,dress,fit,1,0,0,0,10.0,,0,12,66,5_3_to_5_6,145.0,120_to_150,athletic,work,unknown,Fantastic colors!,"Love this dress!  Versatile.  I wore it to work with a black blazer but you could wear this to a party, date, wedding, etc. The colors make it fun; the length makes it appropriate.",length_issue;color_expectation,1
renttherunway,1188641,369514,dress,dress,fit,1,0,0,0,10.0,,0,8,65,5_3_to_5_6,136.0,120_to_150,pear,party,unknown,Feminine and fun,"I wore a pink slip underneath because it might be a bit revealing in the chest. But as all DVF wrap-dresses go, this was divine.",chest_or_bust,1
renttherunway,2566009,574710,jacket,outerwear,small,0,1,0,1,6.0,,1,12,64,5_3_to_5_6,145.0,120_to_150,hourglass,everyday,unknown,"Itchy, and small on the shoulders","It was cute, but uncomfortable. The collar was very itchy! Definitely size up if you have a large bust.",fabric_or_quality;chest_or_bust,1
renttherunway,148690,390396,dress,dress,small,0,1,0,1,6.0,,1,24,65,5_3_to_5_6,,unknown,pear,formal affair,unknown,"Classy dress, but tight on top","Usually the issue for me is that if the top fits, the bottom is too small and vice versa, but in this instance the bottom fit but I couldn't get the back strip to connect so I had to essentially wear it as a backless dress. It worked, but was not ideal. It was also much longer on me than shown on the model.",too_small_or_tight,1
renttherunway,921642,564111,dress,dress,fit,1,0,0,0,10.0,,0,4,64,5_3_to_5_6,115.0,under_120,petite,wedding,unknown,worn to a Rehearsal Dinner -- beautiful dress and fit -- will rent again!,"I typically wear an XS/S, and rented the XSR (size small was not available for the dates I needed). It was slightly snug at the neckline and bust, but I think the size small would have been too large through the rib-cage. I loved the dress, and the print is beautiful. I got compliments on it all evening. Overall, highly recommend this dress.",too_small_or_tight;too_large_or_loose;fabric_or_quality;chest_or_bust,1
renttherunway,126335,378987,dress,dress,fit,1,0,0,0,10.0,,0,16,63,5_3_to_5_6,150.0,120_to_150,pear,wedding,unknown,Stand out dress,"The dress was fabulous. I reserved the 6 and 8 buy chose to wear the 8 because it fit my hips better. I received so many compliments. It shows a lot of cleavage so you may want to pin the top. Regarding the zipper, it was a little tough to zip up. I had a friend help me zip it up and was able to unzip it myself at the end of the night. I wouldn't let that deter you from renting it though.",chest_or_bust;waist_or_hip,1
renttherunway,963476,73760,sheath,dress,fit,1,0,0,0,8.0,,0,8,63,5_3_to_5_6,125.0,120_to_150,athletic,formal affair,unknown,Sparkly fun,"As others mentioned, it was short, but for a cocktail party where you are standing most of the time it was fine.  I wore shorter heels to offset the hemline.  The dress was a great balance: showing a little skin but not too much; conservative color but fun sparkle.",length_issue;color_expectation,1
renttherunway,126335,186838,dress,dress,fit,1,0,0,0,10.0,,0,28,63,5_3_to_5_6,,unknown,apple,party,unknown,I wore this dress to my Vegas Bachelorette and it was amazing!! I kept getting compliments all night,"The fit was great, the fabric was on the stretchier side and the fit forgives the imperfections for someone like me with more curves. It truly is a dress that makes you feel like a million bucks!!",fabric_or_quality,1
renttherunway,858828,568939,sheath,dress,large,0,0,1,1,10.0,,0,24,67,5_7_to_5_9,,unknown,full bust,party,unknown,First experience with RTR and was so happy!  I loved my dress and wish I could keep it!,"Due to stretch in the fabric, I thought it ran a little large. Unfortunately my second size was not available for my date. The color is beautiful, more purple than burgundy.  Fit is off the shoulders so I wore a strapless bra. Faell below the kneeor me. Fabric hides any flaws. Very flattering. I will definitely rent again.",fabric_or_quality;chest_or_bust;color_expectation,1
renttherunway,2673874,506201,jumpsuit,jumpsuit,fit,1,0,0,0,10.0,,0,12,68,5_7_to_5_9,145.0,120_to_150,athletic,wedding,unknown,Loved this alternative for a dressy wedding. Got complimented all night!,"Overall fit was comfortable. Needed heels to make the shorter pant leg look more intentional. Ended up wearing a strapless bra for added support, although the boning in the dress probably would have been fine on its own. I bounce between a 6 and an 8 regularly, but the 6 fit perfectly.",chest_or_bust,1
renttherunway,985087,866301,gown,dress,fit,1,0,0,0,10.0,,0,16,64,5_3_to_5_6,143.0,120_to_150,unknown,formal affair,unknown,Many compliments!!!,I wore this dress for prom. I absolutely loved it. It was actually my backup dress and the only size available was an 8 (which I am but 10 is better for some dresses not all). At first the zipper would stop around the waist area but I got it eventually. It fit me like a glove. I received so many compliments and I really stood out. The slits added a nice touch. The only downfalls was that it was a little too long. I am5'4. Heals made it a little better. The slip underneath wasn't really a problem. I had to pull it down once or twice. I was not able to wear underwear with it and I wore a backless bra. It was an awesome dress that was very fitting and snug.,too_small_or_tight;length_issue;chest_or_bust;waist_or_hip,1
renttherunway,2848341,92826,jacket,outerwear,fit,1,0,0,0,10.0,,0,26,66,5_3_to_5_6,170.0,151_to_180,full bust,everyday,unknown,Love this.... I felt cool and fashion forward!,This is one of my favorite rentals of all times.  The jacket added an extra cool vibe to every outfit. Seriously - I'm buying it!  Loved the fabric which was a soft tweedy boulce but the under the length of the arms and sides were thin jersey-like neoprene.  It made the jacket very comfortable to wear.  Not necessarily super warm but great for cool days/evenings.,length_issue;fabric_or_quality,1
renttherunway,1697200,802716,dress,dress,large,0,0,1,1,8.0,,0,1,60,under_5_3,110.0,under_120,petite,wedding,unknown,I got a lot of compliments on the dress!,"It fit pretty well, was comfortable, and was easy to wear undergarments with it. I think it would have looked even better on someone who is taller. I'm pretty short, but it still fit well enough that everyone said I looked great it in. :)",fabric_or_quality,1
renttherunway,1300249,546983,sheath,dress,fit,1,0,0,0,10.0,,0,4,64,5_3_to_5_6,124.0,120_to_150,athletic,work,unknown,Hello White!,"I love VINCE. Their material is quality and comfortable, while their cuts are flattering for my straight boyish figure. Wore this dress to work with lots of compliments. The only critique is that the bottom hem seemed to be pressed incorrectly.",length_issue;fabric_or_quality,1
renttherunway,1962198,157633,dress,dress,fit,1,0,0,0,10.0,,0,1,64,5_3_to_5_6,112.0,under_120,athletic,party,unknown,gorgeous dress! Doesn't wrinkle!,I wish I could find this dress so I could buy it.  I rented this dress twice and I wish I could find it in the store so I could buy it already.  I love it sooo much and it is sooo my style.  I love that it doesn't wrinkle and it is so easy to style with any shoe or cardigan.  It photographs beautifully and it is perfect for spring and summer day parties.,color_expectation,1
renttherunway,1832871,238934,sheath,dress,fit,1,0,0,0,8.0,,0,12,62,under_5_3,140.0,120_to_150,pear,vacation,unknown,I wore it out for a night out in Vegas beautiful dress!,The fit was perfect...not stretchy so make sure you order the correct size.  Gorgeous dress the only flaw was the inside of my upper arm rubbing against the fabric the sequins were rough on my skin but definitely not enough to bother or regret this dress,fabric_or_quality,1
renttherunway,337074,750989,dress,dress,fit,1,0,0,0,8.0,,0,14,68,5_7_to_5_9,145.0,120_to_150,unknown,wedding,unknown,Simple and sexy!,This dress ran a bit shorter than I was expecting but was a good fit overall.  I received many compliments and my fiancé was definitely happy with my choice. The material is thick and comfy which made it a great choice for a fall wedding.,fabric_or_quality,1
renttherunway,879452,367999,dress,dress,large,0,0,1,1,8.0,,0,1,63,5_3_to_5_6,105.0,under_120,petite,work,unknown,For well but a little big for me around my stomach and hips. I do have a small/narrow frame though.,Was a little big in the stomach/hip area but I do have a small frame. I still wore it and liked it but could have fit a little better.  In my picture I am actually pulling the fabric in the back of the dress tighter. So it's not a completely true depiction of how it fit.,too_small_or_tight;fabric_or_quality;waist_or_hip;color_expectation,1
renttherunway,2248056,142096,sweater,top,small,0,1,0,1,6.0,,1,26,66,5_3_to_5_6,,unknown,hourglass,work,unknown,"Warm, charming, not good for busty girls","The fit was just not flattering.  I think it may be the ""bib"" on the top, which doesn't seem very bulky in photos, but it actually was.",fabric_or_quality;chest_or_bust;color_expectation,1
renttherunway,426346,849924,dress,dress,fit,1,0,0,0,8.0,,0,1,67,5_7_to_5_9,125.0,120_to_150,straight & narrow,party,unknown,"Fun color, beautiful silk dress",This dress was suggested to me by RTR after my 1st choice dress was not available. I wore this dress to a daytime party with low heel sandals.  I also experimented with a dressier look with a rattan belt and wedge heels but decided on a more casual look.  The tangerine color is unique and the silk is beautiful.  Dress was in like-new condition.  I would rent this dress again!,color_expectation,1
renttherunway,123793,958979,gown,dress,fit,1,0,0,0,10.0,,0,4,61,under_5_3,110.0,under_120,petite,formal affair,unknown,"Glamourous, comfortable, eye catching, show stopper. What more couls you ask for?","Wore this to a fundraiser that my husband was being honored at in recognition for his involement in recruiting and registering new donors to the Bone Marrow Transplant registry. I was looking for something that would showcase the tattoo I got in honor of my daughters illness and recovery from HLH. Im not normally the flashy type, but when i put this dress on, I felt like a million bucks! It fit perfectly, without feeling tight. I'm only 5'1"" and was able to wear with a regular heel (no platform/5"" required). I received dozens of compliments and was dubbed ""First Lady of the Gala"" by the event organizers. It was the most beautiful I've ever felt. You won't be disappointed. Rent this dress and know what its like to be a star!",too_small_or_tight;fabric_or_quality,1
renttherunway,344877,39934,maxi,dress,fit,1,0,0,0,10.0,,0,16,67,5_7_to_5_9,140.0,120_to_150,apple,everyday,unknown,Gorgeous print and love the length!,"I love this dress - it was my first piece ordered via my Unlimited account that I wanted to keep.  I paired it with a white leather motorcycle jacket for daytime wear, and it went from day-to-night effortlessly because of the print and the material.  It fit true to size from the standpoint of it's a dress meant to be light, loose and airy, but I could see how folks might want to size down to get a slimmer fit.  At 5'7"", the dress hit at my calves, same as the model picture.",too_large_or_loose;length_issue;fabric_or_quality;color_expectation,1
renttherunway,1858651,748381,dress,dress,fit,1,0,0,0,8.0,,0,8,64,5_3_to_5_6,126.0,120_to_150,hourglass,date,unknown,Great dress! Super comfortable but a little thick for summer wear,"The dress fit very well,had to wear a strapless bra because of the way the sleeves cut. The material is thicker but it worked well for a spring evening. Wore it out for my birthday dinner and couldn't be happier!",fabric_or_quality;chest_or_bust,1
renttherunway,1687082,751632,gown,dress,fit,1,0,0,0,10.0,,0,17,65,5_3_to_5_6,,unknown,unknown,formal affair,unknown,"Loved it! Super comfortable, easy to wear.","I'm 5'5"" -- the long was perfect with 4"" heels! Cant wait to rent in another color!",color_expectation,1
renttherunway,2635020,51637,top,top,small,0,1,0,1,8.0,,0,14,67,5_7_to_5_9,140.0,120_to_150,athletic,everyday,unknown,"Original, chic top, fabric is not matte","I like this top, although I was expecting it to be more matte than what it actually was. The sleeves are great and not as much a handicap as I thought they might be. However, due to the fabric, I would recommend this more for an evening out than for everyday.",fabric_or_quality,1
renttherunway,1832896,145344,sheath,dress,large,0,0,1,1,10.0,,0,4,59,under_5_3,112.0,under_120,unknown,wedding,unknown,Great dress!,"Loved this dress for a wedding in late May 2016. I am usually a size two and I should have sized down to a zero as it was definitely a little big. Since it was a little big, I couldn't get away without a bra. The sides under the armpit go low which meant a strapless bra would show. I got the sticky cups instead and they worked great! Overall, I was impressed with my RTR experience.",chest_or_bust,1
renttherunway,2514175,27229,sweater,top,fit,1,0,0,0,6.0,,1,8,65,5_3_to_5_6,142.0,120_to_150,hourglass,party,unknown,Cute but neck is tight,"Rented this for a girls' dinner. Super cute, worn as a dress with black tights, fit loose but not in an overwhelming way. Fur sleeves were fab. Would go with your normal size, because the body fit is loose but the neck is super tight.  Cons: very warm, hard to fit in jacket sleeves, and neck is VERY tight - uncomfortably so. Also, arrived with very strong cleaning smell. Would consider renting again, but neck was just a little too much for me.",too_small_or_tight;too_large_or_loose,1
renttherunway,1366699,293467,sheath,dress,fit,1,0,0,0,8.0,,0,32,66,5_3_to_5_6,200.0,181_plus,pear,party,unknown,Royal Blue Classic!,"I enjoyed wearing this royal blue dress out to an engagement party.  It feels very classic.  And is more blue than the photos -- I almost didn't recognize it in the RtR Las Vegas Store!  I enjoyed wearing this dress and would consider it again.  This dress is a true Womens size.  The lining has some stretch, so it is really easy to wear.  It has bra hook thingies, but I didn't need them.",length_issue;fabric_or_quality;chest_or_bust;color_expectation,1
renttherunway,1484078,290043,sheath,dress,fit,1,0,0,0,8.0,,0,16,65,5_3_to_5_6,150.0,120_to_150,hourglass,other,unknown,I loved the color and the back of the dress. It was sexy but conservative enough for a work holiday,The dress was true to size. It is snug but comfortable enough to spend the entire night with it on. It does make a weird folding in the front that makes you look like if you have a small belly. I think this happened because the inside slip might have shrunk a little.  Like other reviewers it is comfortable enough to wear braless and not feel exposed. Over all I loved the dress had great comments. A great rental.,too_small_or_tight;fabric_or_quality;chest_or_bust;color_expectation,1
renttherunway,909677,621921,gown,dress,small,0,1,0,1,10.0,,0,8,61,under_5_3,125.0,120_to_150,hourglass,wedding,unknown,Absolute winner.,"I wore this dress for a black tie wedding in May. It's ABSOLUTELY gorgeous in person - the color is so unique and fit like a glove. I'm 5'1"" and I have an hourglass/petite/athletic figure. It definitely runs small and sucks you in a bit, so if you're uncomfortable in tight clothes, I'd say that's the only reason to reconsider. This is such a beautiful dress and I enjoyed every second of wearing it!",too_small_or_tight;color_expectation,1
renttherunway,666794,515980,dress,dress,fit,1,0,0,0,10.0,,0,4,63,5_3_to_5_6,124.0,120_to_150,athletic,wedding,unknown,"Was a great, classy dress for a fall wedding!","Fit well - was snug to my body with an extra layer in the back to make it more wedding appropriate (and length was just above the knee). Fabric was a bit on the thick side but it was cool weather so it was great. Overall, loved it!",too_small_or_tight;length_issue;fabric_or_quality,1
renttherunway,172027,168603,dress,dress,fit,1,0,0,0,10.0,,0,1,62,under_5_3,105.0,under_120,petite,wedding,unknown,LOVED this dress! I got compliments all night.  The fabric is really light and comfortable.,"I wore this to a wedding and would recommend it to anyone!  The fit was true to size and it was just long enough as I'm 5'2"".  The fabric was light and somewhat stretchy.  Love everything about this dress- especially the open back!",fabric_or_quality,1
renttherunway,921642,247451,dress,dress,fit,1,0,0,0,8.0,,0,4,64,5_3_to_5_6,110.0,under_120,petite,wedding,unknown,"Beautiful pattern, perfect for a summer wedding.","It was a lovely dress and I received so many compliments all night long. Very flattering and showed up great in pictures. Fit like a glove and was on the line of almost being too tight. The neck line was beautiful but it was very tight, uncomfortably tight towards the end of the night.",too_small_or_tight;color_expectation,1
renttherunway,286193,977243,dress,dress,small,0,1,0,1,8.0,,0,20,71,5_10_plus,163.0,151_to_180,hourglass,everyday,unknown,Cute dress/tunic,I wore this with leggings. It is kind of short and doesn't sit at actual waist. It is cute and the color is quite muted. May rent again.,waist_or_hip;color_expectation,1
renttherunway,1031440,88342,dress,dress,fit,1,0,0,0,10.0,,0,20,65,5_3_to_5_6,135.0,120_to_150,hourglass,party,unknown,Birthday Girl!,"This Slate & Willow number was perfect for my birthday dinner & party! I've never received so many compliments in one night. Due to my figure I went a size up as the shoulders are the tightest part of the dress from previous reviews. The material is very thick, but the open back really helped especially for a summer birthday. I paired this dress with black heels, a red lip, and RTR Lotus Pendant Earrings.",too_small_or_tight;fabric_or_quality,1
