dataset,item_id,user_id,category_raw,category_group,fit,is_fit,is_small,is_large,is_nonfit,rating,quality,low_signal,size,height_inches,height_bucket,weight_lbs,weight_bucket,body_type,occasion,length,review_summary,review_text,pain_points,has_pain_point
renttherunway,1019581,317749,dress,dress,fit,1,0,0,0,10.0,,0,8,60,under_5_3,130.0,120_to_150,athletic,wedding,unknown,LOVE LOVE LOVE,The waistline has no give at all so definitely order a size up as the back up. I also wore bra cups and  pinned the shoulder straps under the lace to a racerback because they were too long. This was my first RTR dress and I was very happy with it. I felt beautiful and got a ton of compliments!,length_issue;chest_or_bust;waist_or_hip,1
renttherunway,1730006,966845,dress,dress,fit,1,0,0,0,10.0,,0,28,64,5_3_to_5_6,175.0,151_to_180,full bust,party,unknown,SUPER comfortable,"Everyone loved it. I wore it for my bachelorette party and I honestly wanted to keep it! The dress was true to size. I wore a strapless bra with it and it didn't show, not even in the underarms area.",chest_or_bust,1
renttherunway,2163773,426047,jumpsuit,jumpsuit,fit,1,0,0,0,10.0,,0,4,64,5_3_to_5_6,125.0,120_to_150,athletic,party,unknown,"Loved, loved, loved this jumper!","I loved this jumper! I will rent it again for sure! I'm 5'4"" and 125lbs - the XSR fit me perfectly.  The SR was a little too loose on top and didn't wear it because I didn't want anything to fall out. ;)  The length was just above my ankle so I was able to wear a cute, heal with an ankle wrap.  The V in the front was just deep enough to be noticeable but not too revealing. The back draped beautifully, not too revealing at all. I liked that there were pockets but I was only able to carry a tube of lip gloss because they were shallow.  It was a nice material and the gold accent at the neck line was nice too.",too_large_or_loose;length_issue;fabric_or_quality,1
renttherunway,655775,759530,sheath,dress,small,0,1,0,1,10.0,,0,16,68,5_7_to_5_9,148.0,120_to_150,unknown,wedding,unknown,Flattering and comfortable dress,"I must have wide rib cage, had to wear the larger of the two sizes but then a little extra fabric around the arms and mid section.  I didn't think it was noticeable and was more comfortable than the smaller size.",fabric_or_quality,1
renttherunway,397183,342092,dress,dress,fit,1,0,0,0,10.0,,0,8,61,under_5_3,122.0,120_to_150,unknown,other,unknown,So Many Compliments!,Breast and thigh were a little tight on me but the dress was so pretty. The sash didn't come with it unfortunately so I dressed it up with jewelry. I had so many compliments. Felt amazing all night.,too_small_or_tight,1
renttherunway,694477,719539,dress,dress,fit,1,0,0,0,10.0,,0,8,67,5_7_to_5_9,140.0,120_to_150,unknown,formal affair,unknown,Worn at a formal gala event.,This dress is snug in all the right places. I ordered a small (the only size available) and was concerned it would be too tight. It was definitely form fitting but looked classy and was flattering. Received compliments all night long from friends and strangers alike. I felt secure not wearing a bra while wearing it. Would order this dress again :),too_small_or_tight;chest_or_bust,1
renttherunway,1787191,442636,sheath,dress,fit,1,0,0,0,10.0,,0,8,62,under_5_3,130.0,120_to_150,hourglass,party,unknown,Perfect for my bump!,"I was looking for an engagement party dress for my 6 month baby bump, and this one was perfect! The fabric is stretchy and forgiving, but the pattern of the fabric hides imperfections. It was light-weight enough to stand an outside party in August in Louisiana! I received compliments all night long. Pregnant or not, I would have definitely rented this dress!",fabric_or_quality,1
renttherunway,1207456,245027,dress,dress,fit,1,0,0,0,10.0,,0,4,64,5_3_to_5_6,123.0,120_to_150,hourglass,party,unknown,Felt like a Princess,"I felt beautiful and received several compliments! Great for a special occasion, evening, or brunch! Comfortable and elegant if you have a larger bust.",chest_or_bust,1
renttherunway,134393,3997,dress,dress,fit,1,0,0,0,10.0,,0,24,65,5_3_to_5_6,160.0,151_to_180,hourglass,party,unknown,Super fun and SO many compliments!,"I wore this dress for a rehearsal and rehearsal dinner.  This is one of my favorite dresses ever!  The size 12 fit much better than the backup size 14.  My bra showed the tiniest amount in the arm holes, but it wasn't noticeable enough to be an issue.  I definitely needed a bra in this dress.  The colors are beautiful, and the pattern is so fun and unique.  I got compliments all night long!  The cut really accentuated my hourglass figure.  The dress was very comfortable all night long (and it was a late night).  Definitely recommend this dress!!",chest_or_bust;color_expectation,1
renttherunway,312893,752474,gown,dress,large,0,0,1,1,8.0,,0,4,64,5_3_to_5_6,125.0,120_to_150,athletic,wedding,unknown,Stunning color!,"I could have gone with a size 0 as the top was too big and it was really flowy, that's why I belted it. By the end of the night after dancing the beads around the neck and arms scratched a bit but as gorgeous as this dress was it didn't matter. Id rent again just in a smaller size",too_large_or_loose;color_expectation,1
renttherunway,1260731,443596,dress,dress,fit,1,0,0,0,10.0,,0,14,66,5_3_to_5_6,155.0,151_to_180,pear,party,unknown,Definitely makes a statement,"This dress is amazing (like all Herve Ledger dresses) but it's not good for small cup sizes. I'm an A/B and it's just not as flattering on a smaller bust.  Everything else about the dress is amazing. The fabric, like many of this designer, works almost like spanx (sucking in everything you want to hide) resulting in clean lines and a flattering figure on almost everyone.",fabric_or_quality;chest_or_bust,1
renttherunway,2494898,109424,jumpsuit,jumpsuit,large,0,0,1,1,10.0,,0,8,65,5_3_to_5_6,130.0,120_to_150,athletic,vacation,unknown,Sadly the outfit didn't arrive in time for me to take it with me.  So nothing. :(,"I actually loved this jumpsuit. I'd love to own it.  Sadly, I didn't get to wear it because of shipping issues.  But I did try it on!",fabric_or_quality;waist_or_hip,1
renttherunway,466944,680418,gown,dress,small,0,1,0,1,10.0,,0,13,68,5_7_to_5_9,,unknown,athletic,wedding,unknown,This dress is gorgeous.,"I wore this dress to a winter wedding in CA. I received so many compliments. The color is so vibrant, so I wore simple drop earrings and it was perfect. I'm 5ft 8in and wore about 2 inch heels and the length for the long was perfect. It would have been too short had I not gotten the long. I usually wear a 4 but ended up wearing the 6L - it stretches but the 4 was too tight. I wish I could have kept this dress - I'm obsessed.",too_small_or_tight;length_issue;fabric_or_quality;chest_or_bust;color_expectation,1
renttherunway,686884,151751,dress,dress,fit,1,0,0,0,8.0,,0,4,62,under_5_3,115.0,under_120,pear,party,unknown,Sexy but classy!,"I loved the side slit and the black and white was eye catching. I worn in Vegas for a night out. It was a little big on my 5'2'' 115 lbs. frame but it wasn't too bad.  The slit was sexy. It's a midi length on shorties like me but I was okay with that, much shorter and that slit would have been unseemly!",length_issue,1
renttherunway,1694131,77433,sheath,dress,small,0,1,0,1,6.0,,1,24,63,5_3_to_5_6,175.0,151_to_180,hourglass,wedding,unknown,"I wore this to a beautiful garden wedding, and I got a ton of compliments.","I ordered a 12, but probably should have worn a 14.  I wore Spanks, and it didn't seem to help.  I looked pregnant in a few photos because it was rather tight in my midsection.  This dress shows way more cleavage than the pictures indicate.  It was a bit much for a family wedding.  The dress was beautifully detailed.",too_small_or_tight;chest_or_bust;color_expectation,1
renttherunway,1220393,287608,gown,dress,large,0,0,1,1,8.0,,0,16,66,5_3_to_5_6,140.0,120_to_150,athletic,formal affair,unknown,This is a lovely dress.,I got many compliments throughout the night. The only issue is the dress is more orange than red.,,0
renttherunway,2577550,620835,jumpsuit,jumpsuit,large,0,0,1,1,10.0,,0,12,66,5_3_to_5_6,150.0,120_to_150,athletic,party,unknown,Subtly Edgy!,"This jumpsuit is classy with a pop of fun.  I was initially concerned with the cutout and showing sjin, but it is very tasteful and I didn't feel uncomfortable at all. I got a ton of compliments and felt very classy. I would rent again.",,0
renttherunway,654025,26579,sheath,dress,fit,1,0,0,0,10.0,,0,12,63,5_3_to_5_6,130.0,120_to_150,pear,party,unknown,"Comfortable, flattering, unique print!","I am 5'3"" and my biggest worry about this dress was it would be too long and look too 'corporate' for New Years Eve - but it was perfect! Just short enough to be 'fun' without showing too much. Wasn't too big on the bust (I am a 34B/32C), but wasn't super tight either. I have hips and a butt, so I chose to size up and wear the 6 instead of the 4, just so I could drink and eat that night, but the 4 fit very similarly (just a smidge snugger on the hips). The pockets are always a plus and the material was super soft (felt like a brushed cotton). It also had a stretch to it, which also added to the comfort level. The sleeves weren't too tight, also, and I have slightly more muscular arms for my size. Overall, a great dress you can wear to a work event, a wedding or a party!",too_small_or_tight;too_large_or_loose;length_issue;fabric_or_quality;chest_or_bust;waist_or_hip,1
renttherunway,517998,692895,dress,dress,fit,1,0,0,0,10.0,,0,8,63,5_3_to_5_6,130.0,120_to_150,apple,wedding,unknown,Very cute!,"This dress was SO cute! I ordered a 2 and a 4 and ended up going with the 4- the 2 fit around my hips and waist, but since I am a little top heavy and big busted, it was too tight in the chest and arms. The fabric is gorgeous in person, and it is very comfortable. I wore it with a sticky bra, but I feel like most ladies could get away with not wearing a bra at all. I wish it were a couple inches shorter, but that's kind of my problem cuz I'm short. :)",too_small_or_tight;fabric_or_quality;chest_or_bust;waist_or_hip,1
renttherunway,182578,214782,maxi,dress,fit,1,0,0,0,8.0,,0,0,64,5_3_to_5_6,120.0,120_to_150,athletic,wedding,unknown,Great for a black tie event - lots of compliments.,The dress fit perfectly but was a LITTLE short when i put on my 3 inch heels. I ordered it in a petite because usually long dresses are way too long but think a 0R would have been better for me.,length_issue;fabric_or_quality,1
renttherunway,1146287,492542,gown,dress,small,0,1,0,1,8.0,,0,20,61,under_5_3,160.0,151_to_180,pear,wedding,unknown,"Gorgeous dress, so many compliments!","I wasn't sure I would be able to wear this dress - the fitted portion of the top extends further down than the rib cage to just about the natural waist, which I wasn't expecting after looking at the photos/reviews. I am pear shaped so I had to do some magic shifting to zip it up. I received so many compliments on it, so I would highly recommend it, but I would caution that the fitted portion is longer than it seems so choose your size accordingly.",waist_or_hip;color_expectation,1
renttherunway,925665,519050,dress,dress,small,0,1,0,1,10.0,,0,14,67,5_7_to_5_9,130.0,120_to_150,athletic,party,unknown,So many compliments!,"Jaw-dropping dress. Had complete strangers stopping me to gush over the dress. This fits VERY snug, especially the bottom half (for me, anyway!) Since I'm smaller on top, I had to use double-sided tape to keep it from gapping. But it was still fabulous! Plus, RTR sent it to me after the dress I originally rented was returned damaged. I <3 RTR!!",too_small_or_tight,1
renttherunway,364092,683925,dress,dress,fit,1,0,0,0,10.0,,0,12,64,5_3_to_5_6,,unknown,hourglass,everyday,unknown,"Super flattering A-Line, great thick fabric, vibrant color.",The thick fabric is awesome! It held me in a bit and gave me a great hourglass shape. I wore it to work and then out to drinks with my girl friends - was such a hit!,fabric_or_quality;chest_or_bust;color_expectation,1
renttherunway,152836,354617,mini,dress,fit,1,0,0,0,10.0,,0,4,64,5_3_to_5_6,122.0,120_to_150,athletic,formal affair,unknown,This was my first RTR experience and it was perfect! I will definitely do it again!,"The dress does not stretch, but it does have a little give to it. The 2 fit so well, I ended up not even trying the 4 on ( I am usually a 2 or 4 depending on the bust area).  Like all of the other reviews have said, this dress is SHORT! When you are standing it looks great, just be careful where you sit down.  I probably wouldn't rent this dress for a wedding because of how short it gets when you sit down, but for the event I went to I didn't sit down very long so it was fine.  Definitely order a size up for the backup size.  It fits true to size, but a little on the small side.  It really is a fantastic dress. It is so flattering and I got compliments all night.  Photographs well!",fabric_or_quality;chest_or_bust;color_expectation,1
renttherunway,126335,641687,dress,dress,fit,1,0,0,0,8.0,,0,16,66,5_3_to_5_6,150.0,120_to_150,hourglass,party,unknown,The color and sequins are a real showstopper,Wore this dress for a bachelorette party in Vegas... got compliments nonstop!  The color is more pink then silver but it's gorgeous.  The dress is flattering and the sequins just draw the attention straight to you.  You don't have to accessorize too much because the dress pops so much.  Wore with bright pink lipstick and chandelier earrings and everything looked beautiful!,fabric_or_quality;color_expectation,1
renttherunway,1238932,209886,dress,dress,small,0,1,0,1,8.0,,0,8,64,5_3_to_5_6,125.0,120_to_150,pear,wedding,unknown,Loved this dress!,"The dress was great and the color is beautiful, but beware the cut out when you are sitting!",color_expectation,1
renttherunway,2240411,48628,coat,outerwear,fit,1,0,0,0,10.0,,0,20,60,under_5_3,,unknown,hourglass,everyday,unknown,Amazing oversized coat,"I might just keep this all winter.... I get compliments on it every time I wear it. So comfortable and fun. The material is very sturdy, I always feel special when I have it on.",fabric_or_quality,1
renttherunway,755371,582495,gown,dress,fit,1,0,0,0,8.0,,0,12,62,under_5_3,119.0,under_120,pear,formal affair,unknown,I wore this dress for my senior prom and it was absolutely perfect! I got compliments ALL night!,"I got a size 6r and 8r just in case the dress was too tight, but I ended up wearing the 6r and it fit perfectly. The only problem was length, I'm 5'2"" and it was little too long.. Because it was covered in sequins it was also quite scratchy under the arms and on my back when I went to sit down and lean back, Other than it I LOVED it! I got compliments left and right and it made me feel like a princess. My boyfriend couldn't take his eyes off me! I would definitely recommend this dress and I'll more than likely rent this dress again in the future!",too_small_or_tight;length_issue,1
renttherunway,124204,290985,dress,dress,fit,1,0,0,0,10.0,,0,4,63,5_3_to_5_6,117.0,under_120,hourglass,party,unknown,Absolutely stunning dress - perfect for New Year's eve!,"I loved this dress and got complements all night. You will be the center of attention in it - it sparkles a LOT! I loved the way it photographs and the fact that you can rent it, I feel like this is the kind of dress that you want to wear only once! It was perfect for a New Year's eve party in DC. Thank you RTR!",color_expectation,1
renttherunway,1693615,238207,dress,dress,fit,1,0,0,0,10.0,,0,8,63,5_3_to_5_6,135.0,120_to_150,petite,wedding,unknown,Perfect dress. Felt comfortable and pretty.,"I usually wear a four and this dress in a size 4 fit perfectly. The red is darker in person than in the picture. It is more like a maroon or a dark wine color (which I honestly liked better). Highly recommend this dress. Comfortable dancing, felt pretty, received tons of compliments.",color_expectation,1
renttherunway,703458,557359,sheath,dress,fit,1,0,0,0,10.0,,0,24,67,5_7_to_5_9,160.0,151_to_180,athletic,wedding,unknown,Made me feel SKINNY!,"Very pretty dress. Flattering to the figure. It was a little big on me, but that's because I've been losing weight and overestimated the size, but it still hung very nicely and look radiant. The color is lovely. It's stretchy fabric, sturdy construction. I wasn't hot even though the wedding was outside. I could dance in it. I wore spanx and they didn't show because the hem is nice and low. I paired with nude wedge heels and they looked great. No jewelry needed. The dress is the statement. Lots of compliments from strangers. Made me feel fancy at a very fancy wedding.",length_issue;fabric_or_quality;color_expectation,1
renttherunway,965768,677984,gown,dress,large,0,0,1,1,10.0,,0,21,66,5_3_to_5_6,,unknown,hourglass,wedding,unknown,Beautiful - and comfortable - dress,"This dress was a hit! The color is gorgeous and the fabric is quite thick, and thus forgiving. I found it ran a bit large and also very long. I am 5'6"" and typically wear 5"" heels and rent a Long. This is the first time I've had an issue with excess length. Got numerous compliments - would rent again.",length_issue;fabric_or_quality;color_expectation,1
renttherunway,1212992,283927,sheath,dress,large,0,0,1,1,10.0,,0,4,63,5_3_to_5_6,128.0,120_to_150,athletic,wedding,unknown,Love this dress. super fun. very light and not to tight.,it is definitely a statement dress.  the way it fit in the chest was interesting/little weird.   cut out for the waist was just right.,too_small_or_tight;chest_or_bust;waist_or_hip,1
renttherunway,2493150,794598,romper,jumpsuit,large,0,0,1,1,6.0,,1,4,62,under_5_3,115.0,under_120,athletic,everyday,unknown,Very cute and comfy outfit!,"Very cute and comfy outfit, however it ran a bit large. Since the wasit tied I was still able to make it work, however the extra fabric bunched in the front. The fabric is also a bit heavy true denim not light weight chambray.",fabric_or_quality;chest_or_bust,1
renttherunway,1453647,141416,dress,dress,small,0,1,0,1,8.0,,0,8,69,5_7_to_5_9,135.0,120_to_150,straight & narrow,party,unknown,RTR Team Review,"Loved the idea of this dress, but overall not for me. The open back was awesome (loved the draping) and a really cool way to show some skin, but that was the only thing that was really working for me. The straps were very thick and tight on my shoulders, and the bust was extremely small - not a problem I've ever had to face before haha! I would hesitate to try this again in a size up for fear of it slipping out of place - was quite low cut, so I wore petals instead of a bra. I unfortunately had to continually adjust while wearing, but I'm sure this would look fabulous on another lady! I definitely recommend sizing up. Still worked for a fun Sunday baby shower, worn with nude heeled sandals.",too_small_or_tight;fabric_or_quality;chest_or_bust,1
renttherunway,172027,327702,dress,dress,large,0,0,1,1,10.0,,0,1,64,5_3_to_5_6,117.0,under_120,petite,wedding,unknown,Sexy Back! Love the splash of colors,This dress completely stood out - the colors are fun and the back is amazing! Only problem I had was the shoulders were a little loose and I was scared that they would fall off if I danced too hard! :) I would say for my torso the dress ran slightly large,too_large_or_loose;color_expectation,1
renttherunway,2160087,343619,romper,jumpsuit,fit,1,0,0,0,10.0,,0,20,68,5_7_to_5_9,145.0,120_to_150,pear,everyday,unknown,This romper made me feel happy!,"Admittedly this is not a sexy outfit. But it is one that is universally COOL, hip and fun. I had so much fun in this thing.",fabric_or_quality;waist_or_hip,1
renttherunway,147594,376824,shift,dress,large,0,0,1,1,10.0,,0,4,66,5_3_to_5_6,128.0,120_to_150,hourglass,wedding,unknown,The color is delicious!,"The dress definitely runs slightly big. I consider myself between a 2 and a 4 and the 2 fit like a glove! The color really popped with the fall colors of New England. I was comfortable and could dance all night. And the dress has pockets!! I paired it with some silver chandelier earrings and black heels. The lace sleeves were slightly snug, but loosened up as the night went on.",too_small_or_tight;too_large_or_loose;color_expectation,1
renttherunway,1652667,764926,dress,dress,fit,1,0,0,0,10.0,,0,1,62,under_5_3,120.0,120_to_150,hourglass,work,unknown,Loved this for work,"I'm 5'2, 120 with an hourglass shape.  It falls a bit loose in the midsection and tighter around the hips and thighs  (for me) but stayed in place/didn't ride up and was perfect for work.  It has a tighter fabric underneath.  The knitted design part in the front is stiff and doesn't fold so I realized it would fall open when I bent over (showing my chest) so I'd just be aware of that.  Also, the beaded detail is beautiful but is also on the shoulders so I was careful when carrying bags on my shoulder.  Overall I loved it",too_small_or_tight;too_large_or_loose;fabric_or_quality;chest_or_bust;waist_or_hip,1
renttherunway,589412,960432,dress,dress,fit,1,0,0,0,10.0,,0,8,65,5_3_to_5_6,135.0,120_to_150,hourglass,other,unknown,"Elegant, exquisitely sown in a high-end fabric",The dress fit true to size including being fitted in the waist. The high-low is not too high in the front which makes it appropriate for any occasion. The fabric is high-quality with a slight sheen. Would absolutely rent this one again.,fabric_or_quality;waist_or_hip,1
renttherunway,763288,13525,dress,dress,fit,1,0,0,0,10.0,,0,12,64,5_3_to_5_6,135.0,120_to_150,athletic,wedding,unknown,The dress stood out among the colorful wedding party!,"I was a part of a very colorful wedding party!  My friend, the bride, wanted us in a range of colors and patterns for her May wedding.  In a group of 7 bridesmaids with different colored dresses and patterns, my dress definitely still stood out!  I received so many compliments, I did not want to return the dress after the event.  I have a short torso and wide ribcage, so it is important to me to choose dresses that add a little bit more shape and narrows the waist.  I am 5'4"" and about 135 lbs, and the size 6 fit like a glove. I highly recommend this dress!  I would purchase this in a heartbeat if I could.",waist_or_hip;color_expectation,1
renttherunway,123793,55898,gown,dress,fit,1,0,0,0,10.0,,0,13,56,under_5_3,145.0,120_to_150,pear,wedding,unknown,I got soooo many compliments!!,It hugs around the hips and body really nicely to show all the curves.  I liked the longer dress because I liked that it dragged a little.  It made it seem more elegant and covered my feet.,length_issue;waist_or_hip,1
renttherunway,1008474,188359,dress,dress,fit,1,0,0,0,10.0,,0,24,68,5_7_to_5_9,180.0,151_to_180,hourglass,party,unknown,Color Pop!,"This dress has a gorgeous, straight-across strapless neckline and is a rich, vibrant magenta. No necklace necessary. Would recommend pairing with gold jewelry (bangles or fun statement ring). Top was a little roomy on me; it probably fits snugly on ladies with larger busts. A wonderful option for engagement party, wedding, or other cocktail attire event. Would rent again.",too_small_or_tight;chest_or_bust;color_expectation,1
renttherunway,985499,561497,gown,dress,fit,1,0,0,0,10.0,,0,13,66,5_3_to_5_6,145.0,120_to_150,pear,wedding,unknown,Perfect. Flattering. Sophisticated. Comfortable. This dress is everything you want and more.,"Coupled with a simple up-do, gorgeous shoes, a clutch and red lipstick, this dress made the perfect outfit for a formal wedding. I was comfortable and stylish at the same time. I could have worn it for another 4 hours without a complaint.",fabric_or_quality,1
renttherunway,193179,600375,dress,dress,large,0,0,1,1,8.0,,0,1,65,5_3_to_5_6,110.0,under_120,straight & narrow,wedding,unknown,Beautiful dress - very bright!,"This was my first choice for attending a beach wedding - ironically I fit in with the wedding theme perfectly - but I should've guessed - the brides favorite color is yellow and that's the only reason I wore this dress.  This is not my typical style and I don't usually wear bright colors - but I got SOOOO many compliments.  The dress was a little on the loose side, and up until the day of the wedding I was going to wear my backup (which was a little too formal for a beach wedding) but then my friends talked me out of it and told me this dress looked really great.   PROS: pockets, love the damn pockets - perfect dress for a beach wedding CONS:  I tend to be a little flatter on top, so if I had brought a padded bra with me or if I naturally had a larger chest then I think this dress would have felt like it fit perfectly.   One thing I would like to point out, I was under the impression when I rented the dress that this was a backless dress - but it's not (at all).  Completely fine to wear a bra with this dress - no special bra needed.  I would recommend this dress for others, but for me I will probably not rent it again since yellow isn't my color anyway :)",too_large_or_loose;length_issue;fabric_or_quality;chest_or_bust;color_expectation,1
renttherunway,833666,718167,dress,dress,fit,1,0,0,0,8.0,,0,12,66,5_3_to_5_6,145.0,120_to_150,hourglass,wedding,unknown,"Looked great, lots of compliments, fit well. Sequins are painful.","The sequins started rubbing the inside of my arms raw after about 20 minutes. By the end of the night the inside of my arm looked like hamburger meat. It hurt really badly but there was no lasting injury or marks, and everything was fine about 2 hours after taking it off.",fabric_or_quality,1
renttherunway,1799162,41790,dress,dress,small,0,1,0,1,8.0,,0,4,66,5_3_to_5_6,113.0,under_120,straight & narrow,date,unknown,Runs small,"Runs small in the hips, also the ruffles are quite prominent in person",too_small_or_tight;waist_or_hip,1
