dataset,item_id,user_id,category_raw,category_group,fit,is_fit,is_small,is_large,is_nonfit,rating,quality,low_signal,size,height_inches,height_bucket,weight_lbs,weight_bucket,body_type,occasion,length,review_summary,review_text,pain_points,has_pain_point
renttherunway,2378271,981193,romper,jumpsuit,fit,1,0,0,0,10.0,,0,8,64,5_3_to_5_6,,unknown,unknown,everyday,unknown,Stylist Review,"Obsessed with this romper! Perfect for summer. This runs true to size and there is only some stretch within the waist - I would size up for your backup. There is comfortable room in the bust. Because it is an off the shoulder outfit, a strapless bra should be worn with this. The midsection is fitted but there is a decent amount of room in the hips. This romper is definitely short - it comes to about 10+ inches above the knee. I would pair this with wedges or sandals and fun statement earrings!",fabric_or_quality;chest_or_bust;waist_or_hip,1
renttherunway,1310167,45337,gown,dress,fit,1,0,0,0,10.0,,0,8,67,5_7_to_5_9,130.0,120_to_150,pear,formal affair,unknown,STYLIST REVIEW!,"Can't go wrong with a Badgley Mischka gown! I love the muted tone of this gown and the open back adds an amazing twist to the conservative front. While it was very form fitting throughout, it did fit true to size, although  I recommend going up a size in your back up - especially if you have fuller hips. I chose to not wear a bra with this gown because of the open back, but you could definitely use a seamless adhesive bra or silicone coverups for extra comfort and concealment. The length was perfect on me with 3 inch heels but if you are taller than 5'7 and plan on wearing heels I recommend going with the long length!",length_issue;chest_or_bust;waist_or_hip,1
renttherunway,2546173,95493,romper,jumpsuit,large,0,0,1,1,8.0,,0,1,62,under_5_3,,unknown,athletic,everyday,unknown,Not a great fit,The romper was just too baggy to wear.,too_large_or_loose,1
renttherunway,226072,307791,dress,dress,fit,1,0,0,0,10.0,,0,4,66,5_3_to_5_6,,unknown,hourglass,party,unknown,The dress was perfect for Derby!,The 4 fit better in the chest but it was too loose in the waist but the 2 fit perfectly in the waist,too_large_or_loose;chest_or_bust;waist_or_hip,1
renttherunway,124553,610625,dress,dress,large,0,0,1,1,10.0,,0,8,67,5_7_to_5_9,135.0,120_to_150,full bust,wedding,unknown,Lovely wedding guest dress,"Loved the dress.  A little short in the front for me (i'm 5'7""), much too short if I lifted my arms, but I wore it with tights and that was perfect.  As many people mentioned the dress stains easily when wet (even with water).  I found simply using a blow dryer and a towel I could manage to get the water stain to disappear.  Highly recommend especially for a winter event!",too_small_or_tight;length_issue,1
renttherunway,2703625,918534,romper,jumpsuit,fit,1,0,0,0,10.0,,0,20,67,5_7_to_5_9,,unknown,hourglass,date,unknown,Great Color,"I loved wearing this dress out for a fun girls night out in Napa.  I was super concerned that it would be to short in the torso which normally happens to me and rompers but that wasn't the case with this one!  I am 5'7"" and have a very long torso so keep that in mind if you are on the fence.  It made me feel great and was made out of a wonderful fabric that gave a bit of stretch but not to much.  Can't recommend this piece enough!",fabric_or_quality;color_expectation,1
renttherunway,136860,975050,sheath,dress,fit,1,0,0,0,10.0,,0,12,70,5_10_plus,160.0,151_to_180,athletic,date,unknown,Loved this dress!,This dress was extremely comfortable and was so pretty! I would definitely rent/wear this again. Don't mind the sushi baby I have going on in this picture.,color_expectation,1
renttherunway,598696,713352,dress,dress,fit,1,0,0,0,10.0,,0,12,68,5_7_to_5_9,,unknown,unknown,wedding,unknown,beautiful dress for a fall/winter weddding,Loved this dress and got so many compliments. Only complaint was that the neck line was pretty tight when you sat down but would otherwise rent again!,too_small_or_tight,1
renttherunway,595048,385792,shift,dress,large,0,0,1,1,10.0,,0,4,65,5_3_to_5_6,123.0,120_to_150,athletic,party,unknown,This dress is FABULOUS!!,"Big, go down 1 size for perfect fit",,0
renttherunway,1154504,256838,dress,dress,fit,1,0,0,0,6.0,,1,12,66,5_3_to_5_6,130.0,120_to_150,hourglass,work,unknown,"No compliments this time, boo!","I always get compliments when I wear RTR dresses, but not with this one for some reason....the pockets stuck out; I should've taped them down.  I thought this was a smart, sharp looking dress, but it wasn't my best.",length_issue,1
renttherunway,126335,557419,dress,dress,large,0,0,1,1,6.0,,1,12,64,5_3_to_5_6,145.0,120_to_150,athletic,wedding,unknown,RTR is very easy to rent and send back.There is never a hassle and the customer service is wonderful,Dress was more pinkish than the picture.  I wore it as a bridesmaid dress.  I am a b-cup so I had to pin the cleavage area up.  Other than that it was very comfortable.,chest_or_bust;color_expectation,1
renttherunway,123793,973284,gown,dress,fit,1,0,0,0,10.0,,0,4,65,5_3_to_5_6,125.0,120_to_150,hourglass,party,unknown,The amount of complements I received was unparalleled!,The fit was great.  It was snug but by no means uncomfortable.  Both the 2 and 4 fit great but I ended up going with the 2.  It is a thick material which really helps the dress lay very flat and smooth.  I had strangers approach me all night long about the dress!  I do wish I had ordered a long as it was a little bit off the floor.  I am 5'5 and had 2-3 inch heels.,too_small_or_tight;length_issue;fabric_or_quality,1
renttherunway,127865,630128,gown,dress,fit,1,0,0,0,10.0,,0,8,64,5_3_to_5_6,138.0,120_to_150,hourglass,formal affair,unknown,Classy Sexy!,"This dress is classy sexy! I wore this for my 50th birthday black tie affair...I felt so glamorous. It fit snug but in all the right places. The construction is such that it held everything in place beautifully including not needing a bra which is a big deal for me. If you are larger in the bust be comfortable showing cleavage! I loved how it kicked when I walked. So for size reference I am 5'4, wore 3 in heels and length was perfect. I weigh 126 and am a 32DDD, the boning kept me in place just fine. The lace allows for some smooth shape wear if needed. It's stretchy so it was very comfortable...although I didn't eat much a few days prior!",too_small_or_tight;length_issue;fabric_or_quality;chest_or_bust,1
renttherunway,1812370,174985,gown,dress,fit,1,0,0,0,10.0,,0,1,67,5_7_to_5_9,,unknown,unknown,formal affair,unknown,The color and cut are timeless - and head turning. Beautiful dress with a unique cut.,Fit really well.,color_expectation,1
renttherunway,1674806,549068,sheath,dress,fit,1,0,0,0,10.0,,0,26,69,5_7_to_5_9,,unknown,unknown,formal affair,unknown,I felt like a celebrity the dress was gorgeous and I received compliments all night!,"This dress is just gorgeous! The colors the fi,t everything screams glamour! It is form fitting but comfortable and thick enough to hide my love handles. I usually wear size 12 on evening gowns and the XL was perfect. I have broad shoulders and narrow hips but thanks to the stretch of the material it fit perfectly!!!",fabric_or_quality;waist_or_hip;color_expectation,1
renttherunway,1259708,657647,dress,dress,fit,1,0,0,0,10.0,,0,8,68,5_7_to_5_9,140.0,120_to_150,straight & narrow,party,unknown,Fun LBD for a gala event,I wore this to a gala that I attended with my coworkers. It was a fun twist on the LBD. Loved that the fabric was heavy enough to wear it without a bra!,fabric_or_quality;chest_or_bust,1
renttherunway,1112658,235056,dress,dress,fit,1,0,0,0,8.0,,0,8,64,5_3_to_5_6,135.0,120_to_150,hourglass,wedding,unknown,Loved this colorful dress!,"This dress fits like a glove, and the fabric is thick enough that it doens't show bumps etc!  I thought it was super flattering and really comfortable. It is a great way stand out in a sea of black dresses. I paired it with Black wedges and a creme pashmina for an outdoor late summer wedding",fabric_or_quality;color_expectation,1
renttherunway,1944337,344280,dress,dress,fit,1,0,0,0,8.0,,0,12,64,5_3_to_5_6,142.0,120_to_150,pear,everyday,unknown,Looking cute visiting your in-laws always helps.,This dress works for everything. I drove a long road trip and still got there looking cute. It is comfortable and you can dress it up or down. It is a little short for people that might be taller than me.  Love this for everyday.,fabric_or_quality,1
renttherunway,166633,979979,mini,dress,fit,1,0,0,0,10.0,,0,8,64,5_3_to_5_6,120.0,120_to_150,hourglass,party,unknown,"Fun dress, wore for a graduation party that was being hosted at an outdoor bar.","Body hugging, but surprisingly thick material. It is pretty short, but the neckline evens out the dress so it's not overly revealing.",fabric_or_quality,1
renttherunway,615009,748200,maxi,dress,fit,1,0,0,0,10.0,,0,4,69,5_7_to_5_9,125.0,120_to_150,straight & narrow,formal affair,unknown,"I loved this dress. The color, the cut, the fit, everything!","The ONLY downside was that the dress was so long and my heels kept getting caught in the lace. I'm 5'9"" and ordered a regular length, yet it was still too long for me. Otherwise, perfect.",length_issue;fabric_or_quality;color_expectation,1
renttherunway,1877137,870521,maxi,dress,fit,1,0,0,0,10.0,,0,20,66,5_3_to_5_6,,unknown,pear,wedding,unknown,Amazing flattering fit and perfect for beach wedding.,"The top has give to it, but structured.  It was easy to go without bra.  Perfect length (5""6 with 2 inch heels).  There are two layers of non very breathable fabric, so wouldn't recommend for hot weather. Other than that, very comfortable.  I ended up wearing the sleeves up on the shoulder for some more arm coverage, and it looks pretty both ways.",length_issue;fabric_or_quality;chest_or_bust,1
renttherunway,858304,827052,dress,dress,fit,1,0,0,0,8.0,,0,4,69,5_7_to_5_9,135.0,120_to_150,pear,everyday,unknown,Trying new things!,"Generally speaking, I love just about everything I put on by Kate Spade. This dress was pretty adorable, but I personally didn't love the pattern; it looks amazing in the stock photo and the mid-section hits her just right, but it wasn't as pronounced when I wore it and I missed that! Overall, still a great dress and it was my fiance's favorite of the three dresses I rented this time around. :)",fabric_or_quality;color_expectation,1
renttherunway,313568,550470,dress,dress,fit,1,0,0,0,10.0,,0,1,66,5_3_to_5_6,116.0,under_120,pear,work,unknown,Great work dress that was simple and elegant.,"Loved this dress. It was a heavier fabric than I thought but the quality was excellent. Loved the fit and the feel of the fabric. Good length for work, and the darts made the fit seem like something out of Mad Men. Think Joan and pair it with a big pearl necklace and a padded bra.",length_issue;fabric_or_quality;chest_or_bust,1
renttherunway,2884139,545532,jumpsuit,jumpsuit,large,0,0,1,1,8.0,,0,8,64,5_3_to_5_6,127.0,120_to_150,hourglass,work,unknown,"Gorgeous, versatile jumpsuit- tons of compliments","This DvF piece is stunning. I wore it on-air for a public affairs show and have been approached so many times since - not because of the interview, but because of this jumpsuit! The tailoring and the color made me feel truly regal. Plus you can wear it as a professional look or for going out. My only gripe (which is why there are four stars and not five) is that it's low cut. Like, crazy low cut. So low cut that I don't know how anyone wears it without pinning it or double sided tape. My tape actually started to give right before the interview, so I had to pull the back up with a hair tie at last minute. It totally worked and I felt very Fashion MacGyver, but would have been much easier if they simply put a clasp on the front.",color_expectation,1
renttherunway,1280715,292394,dress,dress,small,0,1,0,1,10.0,,0,4,66,5_3_to_5_6,120.0,120_to_150,hourglass,everyday,unknown,Small in the chest for a 34C,I am normally a 2 in dresses. This one was too tight at the top of the bodice. I am reordering in a 4...should work great! It's a beautiful dress!,too_small_or_tight;chest_or_bust,1
renttherunway,2758287,402033,blouse,top,fit,1,0,0,0,10.0,,0,12,66,5_3_to_5_6,,unknown,pear,everyday,unknown,Preppy yet stylish,high quality fabric,fabric_or_quality,1
renttherunway,1419083,386803,dress,dress,fit,1,0,0,0,10.0,,0,12,63,5_3_to_5_6,145.0,120_to_150,athletic,wedding,unknown,I love the color!  It really stands out.,Pockets are a great extra and the lace design overlay.  Very pretty and lots of compliments!,color_expectation,1
renttherunway,2884139,754176,jumpsuit,jumpsuit,large,0,0,1,1,8.0,,0,4,66,5_3_to_5_6,115.0,under_120,athletic,party,unknown,The color of this jumpsuit is GORGEOUS.,"I liked this - I have never worn a jumpsuit before so it was really fun wearing NICE pants to a formal event. However, the bust part of the outfit was a little interesting. Mine gaped (I guess I don't have enough to fill it out properly) and so I had to use a safety pin to pin it closed all night. I didn't love that but wanted to wear the outfit so dealt with it.   Also, and this is just a function of all jumpsuits probably - but peeing is HARD. You have to take off the entire outfit! So remember that if you are renting this for an occasion where you might drink a lot. :)",chest_or_bust;color_expectation,1
renttherunway,1415952,734177,sheath,dress,fit,1,0,0,0,8.0,,0,12,63,5_3_to_5_6,112.0,under_120,athletic,party,unknown,So many compliments on how beautiful the dress was!,Much more formal looking with the gold embroidery than I thought.  It fit true to size.  Even though there was no stretch it did not feel tight at all.   A dress for any season!,too_small_or_tight;fabric_or_quality,1
renttherunway,394079,370209,maxi,dress,fit,1,0,0,0,8.0,,0,16,64,5_3_to_5_6,150.0,120_to_150,athletic,everyday,unknown,I love this dress!,"It’s flowy and body skimming and perfect!  I went home to check the price to buy and that’s a little out of my reach right now.  I got so many compliments (I teach at a high school).  I wore it with a cardigan since it was thin straps.  The straps on the under dress are a little too long for me, so if there was a “short” size I bet it would be perfect.  The under dress straps drooped all day, but the cardigan hid it.  I’ll be wearing this again this weekend to a graduation party.",length_issue;fabric_or_quality,1
renttherunway,227818,869248,sheath,dress,fit,1,0,0,0,10.0,,0,4,62,under_5_3,115.0,under_120,hourglass,date,unknown,Beautiful Fall/Winter dress,This is a great dress. Really well made. Definitely a heavier material that is best for fall/winter. The colored under panel is subtle but still adds a fun pop of color. Dress was comfortable and there is stretch in the skirt material. The only thing that was weird is the zipper ran long on the inside of the dress and poked out a little bit making for a weird bump on my butt.,fabric_or_quality;color_expectation,1
renttherunway,2958376,491589,romper,jumpsuit,fit,1,0,0,0,8.0,,0,24,69,5_7_to_5_9,210.0,181_plus,full bust,party,unknown,Stylist Review,"Super cute. Loved this Romper, even though we couldn't find the belt for it. It worked perfectly without it. Ran a little big in the stomach area, so this can work if you have a small baby bump. The V neck isn't too much with larger busts. Must wear.",chest_or_bust;waist_or_hip,1
renttherunway,2343054,212909,romper,jumpsuit,fit,1,0,0,0,10.0,,0,16,70,5_10_plus,145.0,120_to_150,pear,party,unknown,"Comfortable, easy to wear, and gorgeous",I wore this to a Mardi Gras themed party and it was a total hit. The lace sleeves are the most forgiving I've ever worn without being baggy. I'm tall so I'm glad I ordered a size up from what I normally wear because the shorts were definitely short.  This was my first ever romper and I have no regrets.,too_large_or_loose;length_issue,1
renttherunway,2280839,887647,blouse,top,fit,1,0,0,0,10.0,,0,20,63,5_3_to_5_6,,unknown,hourglass,everyday,unknown,Great everyday top!,"I have a large chest (34DD) so I was worried about this top having a snap-closure down the front. However, it stayed in place all day with no issues. It is extremely flattering with the peplum shape and the print is even more beautiful in person. Would rent again!",chest_or_bust,1
renttherunway,1213427,175423,gown,dress,fit,1,0,0,0,10.0,,0,4,63,5_3_to_5_6,128.0,120_to_150,unknown,formal affair,unknown,"I received a lot of compliments on the dress. Simple, yet elegant and classy!",The dress fit like a glove. Thick material that fit well. I am a size 2 and the fit was true to size. The zipper was a different color on the 4 so beware.,fabric_or_quality;color_expectation,1
renttherunway,1477398,78488,dress,dress,fit,1,0,0,0,10.0,,0,8,63,5_3_to_5_6,135.0,120_to_150,pear,party,unknown,Love!,This dress is not subtle. It fits like a scuba suit. Super tight with no zipper/buttons. I found it really flattering.,too_small_or_tight,1
renttherunway,149739,274914,gown,dress,fit,1,0,0,0,8.0,,0,21,66,5_3_to_5_6,163.0,151_to_180,athletic,formal affair,unknown,seeing my husband's face when I walked in the room...,"I wore this for a black tie event and got lots of compliments.  I normally don't have to wear long dresses being 5'6'', but after reading everyone's review I'm glad i got the long.  It fit perfectly. I will admit that the beading and sequins look a little cheap up close, but from far away it looks great, and photographs great too. This was my first RTR experience and I will defintely do it again! Too easy.",fabric_or_quality;color_expectation,1
renttherunway,131533,506533,gown,dress,fit,1,0,0,0,10.0,,0,1,62,under_5_3,,unknown,petite,formal affair,unknown,The dress!,"This dress felt amazing on. The fabric was soft, the color was gorgeous and it fit well. The only issue I had with it is that I wore a 0R with 4-inch heels, and the dress was still a little too long. I probably should have ordered a petite size.",length_issue;fabric_or_quality;color_expectation,1
renttherunway,786311,790711,sheath,dress,fit,1,0,0,0,10.0,,0,8,64,5_3_to_5_6,132.0,120_to_150,pear,wedding,unknown,"Loved, loved, loved this dress.  Very well made and COMFORTABLE.",I am on the curvier side through the hips and butt.  This dress had plenty of give to accommodate that.  Would definitely recommend and would definitely rent again.,waist_or_hip,1
renttherunway,1207360,372170,sheath,dress,fit,1,0,0,0,10.0,,0,20,66,5_3_to_5_6,165.0,151_to_180,pear,formal affair,unknown,I literally felt like Cinderella.  I received several compliments.  Great dress for Xmas party.,"Nice form fitting, you can go without a bra if you so choose, however I used gel cups to keep everything in place. You need help with the 4 clasp at the neck line so make sure you have extra hands available",fabric_or_quality;chest_or_bust,1
renttherunway,132738,857714,gown,dress,fit,1,0,0,0,10.0,,0,36,65,5_3_to_5_6,200.0,181_plus,full bust,formal affair,unknown,thank you RTR. everything was perfect! my dress arrived when it was suppose to . thank you so much!!,"the dress is so beautiful ! im a plus size lady im a size 18, 42dd . my weight is very even out tho. the 16L fit perfectly. only thing is i ordered a long and should have gotten a regular. but other then the length i was the bell of the ball. i will be renting here again.  if ur plus size this is the dress for you its very flattering and u can wear a reg bra. just put some spanks on and youre good to go. thank you RTR",length_issue;fabric_or_quality;chest_or_bust,1
renttherunway,1356085,380058,sheath,dress,fit,1,0,0,0,8.0,,0,20,62,under_5_3,155.0,151_to_180,petite,party,unknown,"It fit well, was comfortable, and held up to A LOT of dancing.","Nice material made it feel slimming while also forgiving. It looked fancy but not too fancy for a company holiday party, and would have been just as appropriate for a nice dinner out.",fabric_or_quality,1
renttherunway,2842792,698553,top,top,fit,1,0,0,0,10.0,,0,16,64,5_3_to_5_6,145.0,120_to_150,hourglass,work,unknown,Really nice material and good piece or work or an event,"Fit true to size.  I wore a black cami under the shirt, as low cut.  Loved the button detail and the black stitching detail.  Material had a high end feel, and really nice with a pair of black slacks.",fabric_or_quality,1
renttherunway,1013498,897747,dress,dress,large,0,0,1,1,10.0,,0,14,69,5_7_to_5_9,185.0,181_plus,pear,party,unknown,"I love this dress! I rented it for a birthday celebration, and got many compliments. Comfy and chic!","The dress does run large, but I loved it that way. For those who prefer waist definition, a belt is a must--but I love the column look, so I went without. The colors in this dress are what make it special, along with the fact that it's crazy comfortable! I'll probably rent it again. :)",chest_or_bust;waist_or_hip;color_expectation,1
renttherunway,478490,962784,dress,dress,small,0,1,0,1,10.0,,0,1,59,under_5_3,105.0,under_120,petite,other,unknown,Sadly did not get to wear,"Went with another dress, but wish I had another affair to wear this too! Bright color but not neon or overwhelming. Probably should've gotten a 2 (normal size) as 0 was tighter around mid section. Pockets are great. A fun dress for sure :)",too_small_or_tight;color_expectation,1
renttherunway,414009,400157,sheath,dress,fit,1,0,0,0,8.0,,0,4,65,5_3_to_5_6,117.0,under_120,athletic,wedding,unknown,"This dress made me feel sexy and confident, my husband loved it!","It fit great, but is probably better for women with a B or C cup.  I was able to wear a low back bra with it to give ""the girls"" a boost, but the material is thick enough that you could go without.   The color was a little deeper than pictured, but it was very flattering on my skin tone.  It is very fitted, but stretchy enough to move with you.  Not the best dress for lots of dancing or stairs, but worth it as I felt incredible in it.  I would definitely rent again!",fabric_or_quality;chest_or_bust;color_expectation,1
renttherunway,1188641,116142,dress,dress,fit,1,0,0,0,10.0,,0,12,63,5_3_to_5_6,128.0,120_to_150,pear,work,unknown,I love the fun springy pattern of this DVF,"Great fit - could have gone smaller but they didn't have that size. Wrap dress makes sizing very flexible. Perfect length. Originally rented for Easter, but ended up wearing it to work. Lots of compliments.",length_issue,1
renttherunway,180843,24617,dress,dress,fit,1,0,0,0,10.0,,0,8,66,5_3_to_5_6,118.0,under_120,hourglass,date,unknown,Love it!,"This dress is so much cuter than it looks in the picture. I loved it. The top gave a bit more cleavage than I needed, though I would rent it again. The skirt is very flattering and the fabric is nice and thick. It's very comfortable and since I filled it out on top I didn't have any problem with the strap length.",length_issue;fabric_or_quality;chest_or_bust;color_expectation,1
renttherunway,1046957,206900,dress,dress,fit,1,0,0,0,10.0,,0,8,65,5_3_to_5_6,120.0,120_to_150,athletic,work,unknown,I wore this to work.,"The dress was perfect for work. The material is so comfortable, I didn't want to take it off at the end of the day!",fabric_or_quality,1
renttherunway,172914,597555,dress,dress,small,0,1,0,1,8.0,,0,12,67,5_7_to_5_9,135.0,120_to_150,apple,wedding,unknown,Great dress for a summer wedding,"I waffle between a 4 and a 6 in formal dresses, and for this one, although the 4 fit, the 6 was more comfortable and just a hair longer, which made a difference in this dress at my height! I paired it with nude pumps and a gold necklace. It's very much a bright pink with fuschia undertones in real life. If you like shift dresses, this one is a great option! My only complaints are that the dress was a little bit worn and it was very short.",,0
renttherunway,849468,827652,dress,dress,fit,1,0,0,0,8.0,,0,20,66,5_3_to_5_6,170.0,151_to_180,pear,party,unknown,Cute clubwear for a women of my shape and size.,"Loved the style and sheer elements. Because I'm very curvy, this dress would look trashy at an office party (even a nighttime one), but not for a girls night out in say, Vegas.  I had no bra or shapewear on.  * I plan on reviewing everything I try. The majority of reviews are usually on the smaller sizes and I'm definitely not those! My stats: 5' 6"", 169 pds, 36-30-42, size 10-12, L bottom, M top.",fabric_or_quality;chest_or_bust,1
renttherunway,348662,360456,dress,dress,fit,1,0,0,0,8.0,,0,8,62,under_5_3,120.0,120_to_150,petite,everyday,unknown,Lovely and feminine; sexy for a summer date,I wore this dress for a hot day in the city - we had friends coming in and had a mini photo shoot.  This dress is gorgeous and flattering; it looks great in photos!  Major hit - will definitely rent again!,color_expectation,1
renttherunway,1768911,362951,gown,dress,fit,1,0,0,0,10.0,,0,16,65,5_3_to_5_6,,unknown,full bust,formal affair,unknown,Stylist Review,"This dress was even more beautiful in person! The embroidery is so pretty, and the colors are really nice! It was a very flattering fit, but honestly my boobs barely squeezed in there. A small detail that I loved was that the straps were velvet, which was a really nice touch! I'm typically between sizes 8 and 10, but the 8 fit really well other than the bust!",chest_or_bust;color_expectation,1
renttherunway,567599,421771,dress,dress,fit,1,0,0,0,8.0,,0,20,68,5_7_to_5_9,145.0,120_to_150,athletic,formal affair,unknown,very cool back and easy to wear,"This was a fun dress to wear, and I got many compliments. It's plain material, but I dressed it up with a formal shawl and jewelry.  Make sure you have a sticky bra as there is no way to hide straps.   I had to pin the front as it was a bit too low for my taste.",fabric_or_quality;chest_or_bust,1
